title,brand,final_price,images_count,weight,rating,reviews_count
Wuthering Heights (Collins Classics),Emily Brontë,3.99,4,7.8,4.6,13451
THE DAYS THE CRAYONS QUIT,Drew Daywalt,12.08,2,8.5,4.8,16628
Where the Wild Things Are,Maurice Sendak,13.2,6,14.4,4.9,27536
Pretty Girls,Karin Slaughter,9.99,5,11.2,4.3,10050
Mere Christianity,C. S. Lewis,22.49,5,15,4.8,10958
Mere Christianity,C. S. Lewis,13.69,4,6.9,4.8,10958
The Hating Game: A Novel,Sally Thorne,12.59,3,10.4,4.5,14801
The One and Only Ivan,"by Katherine Applegate (Author), Patricia Castelao (Illustrator)",6.96,3,11.8,4.8,17657
Of Mice and Men,John Steinbeck,8.18,5,2.4,4.7,20075
Of Mice and Men (Penguin Great Books of the 20th Century),John Steinbeck,6.69,3,4.2,4.7,20075
The Subtle Art of Not Giving a F*ck: A Counterintuitive Approach to Living a Good Life,Mark Manson,11.5,3,6.8,4.6,58209
They Both Die at the End,Adam Silvera,8.07,4,11.2,4.7,18823
The Bad Seed (The Food Group),Jory JohnPete Oswald,11.73,3,15.3,4.8,11122
"Insurgent (Divergent Series, 2)",Veronica Roth,11.49,3,14.9,4.6,19489
The Hate U Give,Angie Thomas,9.12,4,15.2,4.8,21341
Brave New World,Aldous Huxley,11.55,5,7.4,4.6,18262
The Dutch House: A Novel,Ann Patchett,10.9,1,9.6,4.4,26810
"Good Omens: The Nice and Accurate Prophecies of Agnes Nutter, Witch (Cover may vary)",Neil GaimanTerry Pratchett,8.99,1,8.8,4.7,14729
"The Selection (The Selection, 1)",Kiera Cass,6.48,4,9.3,4.6,11072
The Song of Achilles: A Novel,Madeline Miller,10.35,3,10.4,4.7,31125
"The Boy, the Mole, the Fox and the Horse",Charlie Mackesy,10.35,6,14.4,4.8,87406
The Last Anniversary: A Novel,Liane Moriarty,7.98,1,12.8,4.2,10102
And Then There Were None (Agatha Christie Mysteries Collection (Paperback)),Agatha Christie,9.99,3,7.2,4.5,16752
And Then There Were None,Agatha Christie,7.99,4,6.1,4.5,16752
To Kill a Mockingbird,Harper Lee,7.19,4,9,4.8,53270
The Alice Network: A Novel,Kate Quinn,11.46,4,14.3,4.6,18709
The Last Mrs. Parrish: A Novel,Liv Constantine,12.58,2,10.4,4.4,12379
Leave the World Behind: A Novel,Rumaan Alam,13.59,2,7.2,3.6,11464
"Divergent 10th Anniversary Edition (Divergent Series, 1)",Veronica Roth,8.39,2,13.6,4.6,29549
"Insurgent Anniversary Edition (Divergent Series, 2)",Veronica Roth,10.39,2,15.2,4.6,19489
"Allegiant Anniversary Edition (Divergent Series, 3)",Veronica Roth,9.99,2,15.2,3.9,22362
Finding Freedom: Harry and Meghan,Omid ScobieCarolyn Durand,11.19,4,8.8,4.2,12951
The Woman in the Window: A Novel,A. J Finn,7.98,4,12,4.4,33470
Charlotte's Web,E. B WhiteGarth Williams,5.47,5,8.8,4.8,17487
Corduroy,Don Freeman,7.99,3,3,4.9,12752
Brave New World,Aldous Huxley,17.89,4,12.8,4.6,18262
"Good Omens: The Nice and Accurate Prophecies of Agnes Nutter, Witch",Neil GaimanTerry Pratchett,17.99,2,10.1,4.7,14729
Bridgerton [TV Tie-in] (Bridgertons Book 1),Julia Quinn,11.54,2,11.4,4.6,32433
The Last Mrs. Parrish: A Novel,Liv Constantine,7.48,2,8,4.4,12379
"The Viscount Who Loved Me: Bridgerton (Bridgertons, 2)",Julia Quinn,7.5,4,12.8,4.6,24901
"Offer from a Gentleman, An: Bridgerton (Bridgertons, 3)",Julia Quinn,13.58,2,11.2,4.6,17372
"Romancing Mister Bridgerton: Bridgerton (Bridgertons, 4)",Julia Quinn,8.99,2,12.8,4.6,21038
"To Sir Phillip, With Love: Bridgerton (Bridgertons, 5)",Julia Quinn,7.1,2,10.4,4.6,15975
"When He Was Wicked: Bridgerton (Bridgertons, 6)",Julia Quinn,6.9,2,12,4.6,14459
"It's in His Kiss: Bridgerton (Bridgertons, 7)",Julia Quinn,10.16,2,11.4,4.6,12470
"On the Way to the Wedding: Bridgerton (Bridgertons, 8)",Julia Quinn,7.09,2,14.4,4.6,11480
The Tattooist of Auschwitz: A Novel,Heather Morris,12.4,2,8,4.7,46174
Unfu*k Yourself: Get Out of Your Head and into Your Life (Unfu*k Yourself series),Gary John Bishop,12.99,2,9.6,4.6,16512
Charlotte's Web (Trophy Newbery),E. B. WhiteGarth Williams,7.64,6,4.8,4.8,17487
The Secret Garden (HarperClassics),Frances Hodgson Burnett,6.99,3,8.6,4.7,10041
I've Loved You Since Forever,Hoda KotbSuzie Mason,14.52,3,13.6,4.8,19794
I've Loved You Since Forever Board Book,Hoda KotbSuzie Mason,7.19,2,7,4.8,19794
Pride and Prejudice,Jane Austen,9,3,10.9,4.6,24978
Wuthering Heights (Penguin Classics),Emily Brontë,6.19,2,10.7,4.6,13451
The Picture of Dorian Gray,Oscar Wilde,8.69,5,7.9,4.5,10147
Where the Wild Things Are,Maurice Sendak,5,7,6.4,4.9,27536
"SuperLife: The 5 Simple Fixes That Will Make You Healthy, Fit, and Eternally Awesome",Darin Olien,10.79,2,8.6,4.7,10050
Hillbilly Elegy: A Memoir of a Family and Culture in Crisis,J. D. Vance,7.85,4,8.8,4.5,27096
"Elon Musk: Tesla, SpaceX, and the Quest for a Fantastic Future",Ashlee Vance,13.99,4,12,4.7,13319
The Art of Racing in the Rain,Garth Stein,14.85,3,15,4.7,14886
The Art of Racing in the Rain: A Novel,Garth Stein,9.99,4,9,4.7,14886
12 Rules for Life: An Antidote to Chaos,Jordan B. Peterson,17.63,1,11.5,4.8,43801
"The Alchemist, 25th Anniversary: A Fable About Following Your Dream",Paulo Coelho,8.89,5,8.3,4.7,64522
I'll Be Gone in the Dark: One Woman's Obsessive Search for the Golden State Killer,Michelle McNamara,11.22,2,11.2,4.7,12943
The Guest List: A Novel,Lucy Foley,13.09,2,9,4.2,54938
The Tattooist of Auschwitz: A Novel,Heather Morris,24.99,1,15.5,4.7,46174
Looking for Alaska,John Green,6.4,4,9.6,4.6,13463
The Gruffalo,Julia Donaldson,4.99,4,4.8,4.9,20576
The Outsiders,S. E. Hinton,5.89,4,8,4.8,25054
HarperLuxe The Subtle Art of Not Giving a F*ck: A Counterintuitive Approach to Living a Good Life,Mark Manson,20.71,1,9.6,4.6,58209
The Duke and I: The (Bridgertons Book 1),Julia Quinn,4.99,3,7.2,4.6,32433
"To Sir Phillip, With Love (Bridgertons Book 5)",Julia Quinn,4.48,3,7.4,4.6,15975
When He Was Wicked (Bridgertons Book 6),Julia Quinn,4.48,3,7.2,4.6,14459
The Fault in Our Stars,John Green,6.1,4,12,4.7,57358
Room on the Broom,Julia Donaldson,6.98,3,5.1,4.9,29363
The Book of Longings: A Novel,Sue Monk Kidd,11.5,1,10.4,4.5,12828
The Invention of Wings,Sue Monk Kidd,12.71,2,9.6,4.7,17777
The Boys in the Boat: Nine Americans and Their Epic Quest for Gold at the 1936 Berlin Olympics,Daniel James Brown,9.29,4,11.2,4.8,28517
Everything I Never Told You,Celeste Ng,7.25,3,8,4.3,21486
"The Body Keeps the Score: Brain, Mind, and Body in the Healing of Trauma",by Bessel van der Kolk M.D. (Author),11.4,3,13.4,4.8,39631
Ikigai: The Japanese Secret to a Long and Happy Life,Héctor GarcíaFrancesc Miralles,12.99,3,9.6,4.6,19968
Wreck This Journal: Now in Color,Keri Smith,9.59,1,11.2,4.7,17424
The Salt Path: A Memoir,Raynor Winn,14.9,1,8,4.4,11306
We Were the Lucky Ones: A Novel,Georgia Hunter,8.79,4,9.9,4.7,10610
The Boys in the Boat: Nine Americans and Their Epic Quest for Gold at the 1936 Berlin Olympics,Daniel James Brown,7.48,1,9.9,4.8,28517
Animal Farm,George Orwell,16.99,3,8.4,4.7,26096
Life of Pi,Yann Martel,8.99,4,9.6,4.4,12860
Pride and Prejudice (Oxford World's Classics),Jane Austen,5.95,1,9.5,4.6,24978
The Picture of Dorian Gray (Oxford World's Classics),Oscar Wilde,7.75,3,6.9,4.5,10147
Hinch Yourself Happy: All The Best Cleaning Tips To Shine Your Sink And Soothe Your Soul,Mrs Hinch,17.83,12,15.6,4.7,17523
Lady in Waiting: My Extraordinary Life in the Shadow of the Crown,Anne Glenconner,15.99,1,10.4,4.4,13678
The Monster at the End of This Book,Jon Stone,2.98,1,4,4.9,23181
Just Me and My Dad (Little Critter),Mercer Mayer,3.1,1,2.26,4.8,11409
Sharp Objects,Gillian Flynn,10.22,3,7.2,4.4,16417
Quiet: The Power of Introverts in a World That Can't Stop Talking,Susan Cain,7.73,4,11.2,4.6,16113
The Road (Oprah's Book Club),Cormac McCarthy,12.08,1,11.2,4.4,10644
Americanah,Chimamanda Ngozi Adichie,10.08,4,14.4,4.6,11826
Wild: From Lost to Found on the Pacific Crest Trail,Cheryl Strayed,9.29,1,8.8,4.5,21315
God Gave Us You,Lisa Tawn BergrenLaura J. Bryant,6.29,1,6.9,4.9,18171
Killers of the Flower Moon: The Osage Murders and the Birth of the FBI,David Grann,9.16,1,12.8,4.6,17891
Ready Player One: A Novel,Ernest Cline,11,4,9.6,4.7,40904
Fox in Socks: Dr. Seuss's Book of Tongue Tanglers (Bright & Early Board Books(TM)),Dr. Seuss,3.4,1,1.6,4.9,11778
The Girl with the Dragon Tattoo (Millennium Series),Stieg Larsson,9.7,5,12.6,4.5,13346
Another Monster at the End of This Book,Jon Stone,4.99,1,4,4.9,23181
"Boundaries Updated and Expanded Edition: When to Say Yes, How to Say No To Take Control of Your Life",Henry Cloud,13.23,3,11.3,4.7,18440
A Wrinkle in Time (Time Quintet),Madeleine L'Engle,5.35,2,7.2,4.6,10229
Call Me by Your Name: A Novel,André Aciman,10.89,2,8,4.7,16661
First 100 Words: A Padded Board Book,Roger Priddy,4.78,3,8,4.7,31423
Still Life,Louise Penny,9.76,3,9.6,4.3,16032
On the Night You Were Born,Nancy Tillman,4.98,3,8.9,4.9,13550
Winter Garden,Kristin Hannah,7.56,4,14.4,4.6,18128
"Twilight (The Twilight Saga, Book 1)",Stephenie Meyer,10.16,6,15.9,4.7,18585
Outliers: The Story of Success,Malcolm Gladwell,14.15,1,10.6,4.7,18586
The Office: A Day at Dunder Mifflin Elementary,Robb PearlmanMelanie Demmer,11.51,4,14.4,4.9,12835
Lone Survivor: The Eyewitness Account of Operation Redwing and the Lost Heroes of SEAL Team 10,Marcus Luttrell,10.16,4,12.8,4.8,16175
"Troubles in Paradise (Volume 3) (Paradise, 3)",Elin Hilderbrand,13.08,1,10.7,4.5,14680
Little Leaders: Bold Women in Black History (Vashti Harrison),Vashti Harrison,11.48,5,15.2,4.9,10893
The Invisible String,Patrice KarstJoanne Lew-Vriethoff,8.99,4,7.1,4.8,14226
The Cuckoo's Calling (Cormoran Strike),Robert Galbraith,11.8,6,14.6,4.2,24202
Talking to Strangers: What We Should Know about the People We Don't Know,Malcolm Gladwell,15.44,1,13.6,4.5,12835
"The Wicked King (The Folk of the Air, 2)",Holly Black,10.99,4,10.9,4.7,11069
"The Queen of Nothing (The Folk of the Air, 3)",Holly Black,10.99,2,10.6,4.7,12296
Circe,Madeline Miller,11.1,4,12.8,4.6,25601
"Sword of Destiny (The Witcher, 2)",Andrzej SapkowskiDavid French,15.49,3,11.2,4.8,11599
The Catcher in the Rye,J. D. Salinger,12.78,5,9.3,4.5,23720
The Catcher in the Rye,J.D. Salinger,5.21,4,4,4.5,23720
The Catcher in the Rye,J. D. Salinger,15.99,5,14.2,4.5,23720
The Autobiography of Malcolm X: As Told to Alex Haley,Alex Haley,6.99,4,8.6,4.8,13577
The Autobiography of Malcolm X (As Told to Alex Haley),Alex Haley,10.19,1,13.2,4.8,13577
Women Who Run with the Wolves: Myths and Stories of the Wild Woman Archetype,by Clarissa Pinkola Estés (Author),7.99,4,10,4.7,10746
Mindset: The New Psychology of Success,Carol S. Dweck,8.55,4,8.4,4.6,11514
I Know Why the Caged Bird Sings,Maya Angelou,7.92,3,5.3,4.8,16235
Defending Jacob: A Novel,William Landay,12.78,3,14.2,4.4,13375
Jurassic Park: A Novel,Michael Crichton,5.14,1,8.8,4.8,10147
Red Rising,Pierce Brown,10.39,1,12,4.6,11776
Sycamore Row (The Jake Brigance),John Grisham,7.49,3,12,4.6,31304
Gray Mountain: A Novel,John Grisham,7.48,1,9.6,4.0,25415
Small Great Things: A Novel,Jodi Picoult,13.58,1,14.4,4.7,20527
Call Me by Your Name: A Novel,André Aciman,21.08,1,13.6,4.7,16661
The Underground Railroad: A Novel,Colson Whitehead,13.01,1,8.8,4.5,17466
The Nickel Boys: A Novel,Colson Whitehead,10.88,2,8,4.6,17134
Deep Work,Cal Newport,13.7,2,13.3,4.6,10449
The Vanishing Half: Shortlisted for the Women's Prize 2021,Brit Bennett,16.6,2,10.7,4.4,78423
If Animals Kissed Good Night,Ann Whitford Paul,4.44,3,8.8,4.8,58744
Holes,Louis Sachar,18.99,2,13.4,4.8,15096
"The Pout-Pout Fish (A Pout-Pout Fish Adventure, 1)",Deborah DiesenDan Hanna,14.39,5,15.2,4.9,20615
The Pout-Pout Fish,Deborah Diesen,5,5,9.6,4.9,20615
"A Wrinkle in Time (A Wrinkle in Time Quintet, 1)",Madeleine L'Engle,11.69,3,12.5,4.6,10229
I Know Why the Caged Bird Sings,Maya Angelou,24,2,14.6,4.8,16235
The Monster at the End of This Book (Sesame Street) (Big Bird's Favorites Board Books),Jon Stone,4.74,1,4.2,4.9,23181
Junie B. Jones's First Boxed Set Ever! (Books 1-4),Barbara Park,14.01,1,9.6,4.8,13409
"Magic Tree House Boxed Set, Books 1-4: Dinosaurs Before Dark, The Knight at Dawn, Mummies in the Morning, and Pirates Past Noon",Mary Pope Osborne,11.95,1,9.6,4.8,16279
Happy Birthday to You! (Mini Pops),Dr. Seuss,8.99,1,4,4.8,10057
Rebecca,Daphne Du Maurier,10.19,3,10.8,4.5,10678
Coraline,Neil Gaiman,8.99,4,4.8,4.8,10883
Coraline,Neil Gaiman,13.64,1,10.4,4.8,10883
Slaughterhouse-Five: A Novel,Kurt Vonnegut,26,1,12.8,4.5,10947
Slaughterhouse-Five: A Novel (Modern Library 100 Best Novels),Kurt Vonnegut,14.99,1,7.5,4.5,10947
The Guernsey Literary and Potato Peel Pie Society,Mary Ann ShafferAnnie Barrows,10.1,4,7.8,4.7,13292
Where Do Diggers Sleep at Night? (Where Do...Series),Brianna Caplan SayresChristian Slade,7.18,1,8.3,4.8,11705
The Wonderful Things You Will Be,Emily Winfield Martin,8.55,1,15.2,4.9,18752
P is for Potty! (Sesame Street) (Lift-the-Flap),"by Naomi Kleinberg (Author), Christopher Moroney (Illustrator)",5.68,6,6.4,4.7,24338
"Tuesdays with Morrie: An Old Man, A Young Man and Life's Greatest Lesson",Mitch Albom,12.99,1,10.2,4.8,14255
The Handmaid's Tale,Margaret Atwood,7.99,4,8.8,4.4,50377
"Darker: Fifty Shades Darker as Told by Christian (Fifty Shades Of Grey Series, 5)",E L James,11.94,1,12.8,4.8,14127
The Maze Runner (Book 1),James Dashner,4.99,1,12,4.5,14172
We Were Liars,E. Lockhart,12.2,1,12,4.5,31424
We Were Liars,E. Lockhart,5.98,1,11.4,4.5,31424
"The Boy in the Striped Pajamas by Boyne, John (2006) Hardcover",John Boyne,15.3,3,11.2,4.7,15426
The Boy In the Striped Pajamas (Movie Tie-in Edition) (Random House Movie Tie-In Books),John Boyne,7.21,3,6.4,4.7,15426
How to Babysit a Grandma,Jean ReaganLee Wildish,9.36,5,12.8,4.8,11647
Astrophysics for People in a Hurry,Neil deGrasse Tyson,9.49,2,9.1,4.7,17736
Norse Mythology,Neil Gaiman,10.19,4,13.1,4.7,13451
Twisted Twenty-Six (Stephanie Plum),Janet Evanovich,7.48,3,6.4,4.7,14669
The Very Hungry Caterpillar,Eric Carle,5.06,7,6.4,4.9,43177
The Cat in the Hat,Dr. Seuss,5.23,1,8.8,4.9,15785
One Fish Two Fish Red Fish Blue Fish,Dr. Seuss,5.23,1,9.4,4.9,14307
Green Eggs and Ham,Dr.Seuss,8.12,1,8.8,4.9,18241
Are You My Mother ?,P.D. Eastman,5,1,8.8,4.9,15012
Where's Spot?,Eric Hill,4.97,5,8.8,4.8,23322
Fox in Socks (Beginner Books),Dr. Seuss,4.96,1,8,4.9,11778
Happy Birthday to You!,Dr. Seuss,11.19,1,14.4,4.8,10057
How the Grinch Stole Christmas! (Classic Seuss),Dr. Seuss,9.9,1,14.2,4.9,13404
Lord of the Flies,William Golding,5.99,4,4.8,4.6,24888
It's Not Easy Being a Bunny (Beginner Books(R)),Marilyn Sadler,6.94,1,7,4.8,12673
Where the Red Fern Grows,Wilson Rawls,13.69,2,14.6,4.8,10395
Number the Stars,Lois Lowry,12.99,4,9.4,4.8,10342
The Giver of Stars: A Novel,Jojo Moyes,10.36,4,12.8,4.6,40237
We Were the Lucky Ones: A Novel,Georgia Hunter,9.46,1,11.2,4.7,10610
Who Moved My Cheese,Spencer Johnson,8.89,4,8.4,4.6,12738
Wreck This Journal (Black) Expanded Edition,Keri Smith,10.29,9,10.6,4.7,10211
Born a Crime: Stories from a South African Childhood,Trevor Noah,10.7,1,8.8,4.8,39852
The Water Dancer: A Novel,Ta-Nehisi Coates,12.31,1,11.2,4.6,11732
Past Tense: A Jack Reacher Novel,Lee Child,8.9,1,9.6,4.4,15528
Blue Moon: A Jack Reacher Novel,Lee Child,7.48,4,8.8,4.4,28278
Trump: The Art of the Deal,Donald J. Trump,13.33,2,10.4,4.7,11170
The Help,Kathryn Stockett,11.2,1,15.2,4.8,16459
Tarcherperigee Burn After Writing,Sharon Jones,6.99,3,7.2,4.6,34724
What Alice Forgot,Liane Moriarty,11.2,2,13.6,4.4,17738
Big Little Lies,Liane Moriarty,9.44,1,14.7,4.6,28283
Bared to You (A Crossfire Novel),Sylvia Day,14.99,2,10.1,4.4,12795
Before We Were Yours: A Novel,Lisa Wingate,11.3,1,10.2,4.7,36118
The Outsiders 50th Anniversary Edition,S. E. Hinton,15.29,2,12,4.8,25054
The Hunger Games (Book 1),Suzanne Collins,11.04,3,11.2,4.7,38586
Harry Potter and the Chamber of Secrets (2),J. K. Rowling,6.98,3,8,4.8,33308
Harry Potter and the Prisoner of Azkaban (3),J.K. Rowling,8.78,1,10.2,4.9,33749
Harry Potter and the Half-Blood Prince (Book 6),J.K. Rowling,10,2,15.5,4.9,27632
"Bob Books, Set 1: Beginning Readers",Bobby Lynn Maslen,10.19,3,9.6,4.8,16234
Slaughterhouse-Five (Modern Library 100 Best Novels),Kurt Vonnegut,7.99,1,3.84,4.5,10947
Outlander,Diana Gabaldon,4.99,4,14.4,4.7,38182
Dragonfly in Amber: A Novel (Outlander),Diana Gabaldon,7.64,4,15.2,4.8,18323
Holes (Holes Series),Louis Sachar,4.67,1,6.7,4.8,15096
Battlefield of the Mind: Winning the Battle in Your Mind,Joyce Meyer,10.99,5,12.2,4.8,14403
"Kindergarten, Here I Come!",D.J. Steinberg,3.74,5,3.21,4.8,14851
The Richest Man in Babylon,George S. Clason,8.99,1,4.6,4.7,21870
World Without End: A Novel (Kingsbridge),Ken Follett,7.81,2,15.2,4.7,12128
Fall of Giants: Book One of the Century Trilogy,Ken Follett,8.49,4,14.4,4.5,15638
Winter of the World: Book Two of the Century Trilogy,Ken Follett,8.52,3,13.6,4.6,15256
Corduroy,Don Freeman,4.28,1,10.5,4.9,12752
Conversations with Friends: A Novel,Sally Rooney,13.71,2,9,4.2,10119
1984,George Orwell,7.48,4,7.2,4.7,55581
Animal Farm: 75th Anniversary Edition,George Orwell,7.48,3,3.84,4.7,26096
1984,George Orwell,11.63,4,8,4.7,55581
"A New Earth: Awakening to Your Life's Purpose (Oprah's Book Club, Selection 61)",Eckhart Tolle,8.93,4,12,4.7,10047
Alice's Adventures in Wonderland (Dover Thrift Editions),Lewis Carroll,2.99,3,2.93,4.5,11978
Twelve Years a Slave (African American),Solomon Northup,7.99,3,14.4,4.6,15993
A Christmas Carol (Dover Thrift Editions),Charles Dickens,2.99,3,2.61,4.7,12865
I Need a New Butt!,Dawn McMillan,5.47,6,5.6,4.7,16689
Echo Burning (Jack Reacher),Lee Child,4.5,3,10.4,4.5,10626
Without Fail (Jack Reacher),Lee Child,4.5,1,11.4,4.6,10542
The Whole-Brain Child: 12 Revolutionary Strategies to Nurture Your Child's Developing Mind,Daniel J. SiegelTina Payne Bryson,10.76,4,5.6,4.8,11457
The Martian,Andy Weir,10.41,1,10.4,4.7,46388
The Perks of Being a Wallflower,Stephen Chbosky,8.22,4,6.9,4.7,19215
How to Stop Worrying and Start Living,Dale Carnegie,9.99,3,8.6,4.6,13220
Moo Baa La La La,Sandra Boynton,3.47,6,5,4.8,14339
The Going-To-Bed Book,Sandra Boynton,3.59,6,5.1,4.8,12326
Burn After Writing (Pink),Sharon Jones,6.99,4,7.2,4.6,19131
"Many Lives, Many Masters: The True Story of a Prominent Psychiatrist, His Young Patient, and the Past-Life Therapy That Changed Both Their Lives",Brian L. Weiss,13.76,3,6.3,4.7,10697
Puppy Birthday to You! (Paw Patrol) (Little Golden Book),"by Golden Books (Author), Fabrizio Petrossi (Illustrator)",4.74,1,4,4.8,11155
The Martian: A Novel,Andy Weir,5.29,1,8.5,4.7,46388
Grumpy Monkey,Suzanne Lang,6.97,1,13.6,4.8,19016
First Little Readers Parent Pack: Guided Reading Level A: 25 Irresistible Books That Are Just the Right Level for Beginning Readers,Deborah Schecter,13.29,1,14.4,4.7,23367
The Wonky Donkey,Craig Smith,5.28,3,2.56,4.8,64835
Where the Crawdads Sing,Delia Owens,24.99,1,12.3,4.8,196572
The Whole-Brain Child: 12 Revolutionary Strategies to Nurture Your Child's Developing Mind,Daniel J. SiegelTina Payne Bryson,13.39,1,15.2,4.8,11457
The Guardians: A Novel,John Grisham,17.26,1,8.8,4.5,30098
Untamed (Random House Large Print),Glennon Doyle,16.73,1,15.2,4.6,56480
Giraffes Can't Dance,Giles AndreaeGuy Parker-Rees,6.28,5,9.6,4.8,27188
Bad Blood: Secrets and Lies in a Silicon Valley Startup,John Carreyrou,12.97,1,12,4.7,11868
Greenlights,Matthew McConaughey,29.99,1,5.6,4.7,48136
"Oh, the Places You'll Go!",Dr. Seuss,8.98,1,15.2,4.9,33603
Squeeze Me: A novel,Carl Hiaasen,12.98,1,9.9,4.4,16387
"We're Different, We're the Same (Sesame Street) (Pictureback(R))",Joe Mathieu,3.3,1,2.79,4.9,10132
The Beekeeper of Aleppo: A Novel,Christy Lefteri,8.96,1,8.8,4.4,19169
Looking For Alaska,John Green,16.99,4,14.1,4.6,13463
Catching Fire |Hunger Games|2,Suzanne Collins,7.98,3,11.7,4.7,28969
The Guardians: A Novel,John Grisham,10.8,1,8.8,4.5,30098
The Lincoln Highway: A Novel,Amor Towles,39.95,1,12.4,4.5,14056
The Gifts of Imperfection: 10th Anniversary Edition: Features a new foreword and brand-new tools,Brené Brown,13.14,1,13.6,4.7,25019
Sooley: A Novel,John Grisham,33.2,1,8.5,4.5,28404
The Hill We Climb: An Inaugural Poem for the Country,Amanda Gorman,9.58,4,5.1,4.9,12392
Are You My Mother? (Bright & Early Board Books(TM)),P.D. Eastman,3.3,1,4,4.9,15012
High Achiever: The Incredible True Story of One Addict's Double Life,Tiffany Jenkins,12.18,1,12,4.7,15251
Oh Say Can You Say Di-no-saur?: All About Dinosaurs (Cat in the Hat's Learning Library),Bonnie Worth,5.47,1,8.5,4.8,14106
There's No Place Like Space: All About Our Solar System (Cat in the Hat's Learning Library),Tish RabeAristides Ruiz,8.98,3,7,4.8,22023
Mockingjay (Hunger Games),Suzanne Collins,8.69,3,11.5,4.6,33370
Better Off Dead: A Jack Reacher Novel,Lee Child,20.54,1,14.4,4.1,17655
I Am a Big Brother (Caroline Jayne Church),Caroline Jayne Church,5,5,6.4,4.8,11985
A Long Petal of the Sea: A Novel,Isabel Allende,14.49,1,9.1,4.4,10398
Camino Winds: A Novel,John Grisham,7.48,1,6.4,4.4,26661
Guts: A Graphic Novel,Raina Telgemeier,5.9,4,14.1,4.8,11788
A Time for Mercy: A Jake Brigance Novel,John Grisham,7.48,1,12,4.6,65351
A Time for Mercy: A Jake Brigance Novel,John Grisham,14.38,1,12,4.6,65351
Jesus Calling - Deluxe Edition Teal Cover: Enjoying Peace in His Presence,Sarah Young,9.39,3,14,4.9,30551
"The Splendid and the Vile: A Saga of Churchill, Family, and Defiance During the Blitz",Erik Larson,40.61,1,12.8,4.7,24717
The Judge's List: A Novel (The Whistler),John Grisham,39.99,1,6.4,4.5,23704
The Ride of a Lifetime: Lessons Learned from 15 Years as CEO of the Walt Disney Company (Random House Large Print),Robert Iger,16.8,1,15.5,4.8,11741
"The Old Man and The Sea, Book Cover May Vary",Ernest Hemingway,11.39,4,4.9,4.6,14695
Teach Yourself to Play Guitar: A Quick and Easy Introduction for Beginners,David M. Brewster,6.99,1,6.6,4.4,11537
Such a Fun Age,Kiley Reid,10.36,1,9.6,4.2,21648
Hair Love,Vashti Harrison,8.98,1,13.4,4.9,15358
A Long Walk to Water: Based on a True Story,Linda Sue Park,14.4,3,9.3,4.8,13442
"Relationship Goals: How to Win at Dating, Marriage, and Sex",Michael Todd,11.16,1,11.4,4.8,19696
When God Made You,Matthew Paul Turner,7.39,1,9.5,4.9,16525
The Midnight Library: A Novel,Matt Haig,13.29,1,14.4,4.3,122000
Number the Stars,Lois Lowry,8.99,5,4.5,4.8,10342
A Long Walk to Water: Based on a True Story,Linda Sue Park,7.64,3,3.52,4.8,13442
Battle Ground (Dresden Files),Jim Butcher,7.48,1,10.4,4.8,20253
The Testaments: A Novel (The Handmaid's Tale),Margaret Atwood,12.26,3,11.2,4.6,25363
Hidden Valley Road: Inside the Mind of an American Family,Robert Kolker,14.85,1,12.8,4.5,12424
Origin: A Novel (Robert Langdon),Dan Brown,8.35,1,12.2,4.4,29463
"My Sister, the Serial Killer: A Novel",Oyinkan Braithwaite,9.63,1,8.8,4.2,10366
The Return of the King: Being the Third Part of the Lord of the Rings,J.R.R. Tolkien,12.14,2,12.8,4.8,17171
The Hobbit,J. R. R. Tolkien,12.92,4,9.6,4.8,28562
Our Class is a Family,Shannon Olsen,11.99,2,4.2,4.8,10447
Jane Eyre (Bantam Classics),Charlotte Bronte,5.95,2,8.4,4.6,14852
A Christmas Carol (Bantam Classics),Charles Dickens,3.95,2,2.19,4.7,12865
Pride and Prejudice (Bantam Classics),Jane Austen,5.95,3,5.8,4.6,24978
The Giver (1) (Giver Quartet),Lois Lowry,5.55,5,7.2,4.7,22330
Where the Red Fern Grows,Wilson Rawls,6.19,3,5,4.8,10395
The Silmarillion,J.R.R. Tolkien,15.49,3,11.2,4.7,10261
Number the Stars 25th Anniversary,Lois Lowry,16.19,2,9.6,4.8,10342
The Giver Movie Tie-In Edition (1) (Giver Quartet),Lois Lowry,5,3,7.7,4.7,22330
Foundation,Isaac Asimov,6.79,4,5.8,4.5,10805
A Brief History of Time,Stephen Hawking,7.99,1,11.6,4.7,12030
The Outsiders 40th Anniversary edition,S. E. Hinton,13.28,2,10.9,4.8,25054
One Day in December: A Novel,Josie Silver,12.58,1,10.4,4.4,12557
We're Going on a Bear Hunt (Classic Board Books),Michael Rosen,7.99,3,8.8,4.8,10531
The Outsiders,S. E. Hinton,13.39,1,11.2,4.8,25054
Spilled Milk: Based on a true story,K.L Randis,19.99,3,14.9,4.7,18179
Mexican Gothic,Silvia Moreno-Garcia,12.07,2,9.6,4.2,17554
The Guardians: A Novel,John Grisham,7.48,1,8.8,4.5,30098
Where Is Baby's Belly Button? A Lift-the-Flap Book,Karen Katz,4.98,3,7.1,4.8,10439
Chicka Chicka Boom Boom,John Archambault,8.99,3,5.8,4.9,28340
Hatchet,Gary Paulsen,11.59,3,10.2,4.7,16012
Create This Book 2,Moriah Elizabeth,13.99,2,11.2,4.8,12878
Create This Book,Moriah Elizabeth,13.99,4,10.4,4.8,15317
Potty (Leslie Patricelli board books),Leslie Patricelli,6.29,4,10.9,4.7,11820
You Are a Badass: How to Stop Doubting Your Greatness and Start Living an Awesome Life,Jen Sincero,8.45,6,7.6,4.7,31132
The Communist Manifesto,Karl MarxFriedrich Engels,3,2,2.08,4.3,10614
"I Am Confident, Brave & Beautiful: A Coloring Book for Girls",Hopscotch Girls,6.99,6,5.6,4.8,26812
The Screaming Goat (Book & Figure),,7.7,2,2.82,4.7,22185
Sesame Street: The Monster at the End of this Book: Includes Illustrated Book and Grover Backpack Clip (RP Minis),Jon Stone,9.95,1,1.48,4.9,23181
Goodnight Moon,Margaret Wise Brown,5.36,6,6.1,4.9,20708
"Forgiving What You Can't Forget: Discover How to Move On, Make Peace with Painful Memories, and Create a Life That’s Beautiful Again",Lysa TerKeurst,14.4,5,15.8,4.8,16219
Wacky Waving Inflatable Tube Guy (RP Minis),"by Conor Riordan (Author), Gemma Correll (Illustrator)",6.79,3,6.3,4.0,33666
Bob Ross Bobblehead: With Sound! (RP Minis),Bob Ross,6.85,5,2.89,4.7,15696
Everyday Tarot Mini Tarot Deck (RP Minis),Brigit Esselmont,10.39,3,8.5,4.8,10863
"The Henna Artist: A Novel (The Jaipur Trilogy, 1)",Alka Joshi,13.66,3,9.5,4.5,14789
The Lost Apothecary: A Novel,Sarah Penner,13.99,1,15.2,4.3,18405
"The Henna Artist: A Novel (The Jaipur Trilogy, 1)",Alka Joshi,13.98,1,13.8,4.5,14789
"Virgin River (A Virgin River Novel, 1)",Robyn Carr,10.69,2,10.4,4.6,11102
The Glass Castle: A Memoir,Jeannette Walls,13.15,4,9.6,4.6,16213
The Name of the Wind,Patrick Rothfuss,9.89,4,12.4,4.7,21138
The Coldest Winter Ever: A Novel,Sister Souljah,9.98,3,10.6,4.9,15405
